"";"X";"entry_number";"X._fa";"prism.url";"dc.identifier";"eid";"dc.title";"dc.creator";"prism.publicationName";"prism.issn";"prism.volume";"prism.coverDate";"prism.coverDisplayDate";"prism.doi";"pii";"dc.description";"citedby_count";"prism.aggregationType";"subtype";"subtypeDescription";"author_count..limit";"author_count..total";"author_count..";"authkeywords";"article_number";"source_id";"fund_acr";"fund_no";"fund_sponsor";"openaccess";"openaccessFlag";"prism.eIssn";"prism.issueIdentifier";"prism.pageRange";"freetoread.value..";"freetoreadLabel.value..";"year"
"97";97;97;"true";"https://api.elsevier.com/content/abstract/scopus_id/85127638085";"SCOPUS_ID:85127638085";"2-s2.0-85127638085";"Analysing perceptions towards electric cars using text mining and sentiment analysis: A case study of the newly introduced TOGG in Turkey";"Penpece Demirer D.";"Applied Marketing Analytics";"20547544";"7";"2022-03-01";"Spring 2022";NA;NA;"The electric car market is growing steadily around the world and, accordingly, has become an attractive research area. It is important to understand the consumer perspective on newly introduced electric cars, such as those of Turkey’s Automobile Joint Venture Group Inc. (TOGG). Thus, the purpose of this study is to provide a better understanding of consumers’ perceptions related to the newly introduced TOGG, which may create a competitive advantage. Social media is an abundant source of textual data that allows for very reliable analysis and understanding of consumer opinions. In this study, Twitter comments on TOGG were collected and studied. Text mining, sentiment analysis and topic model analysis were then conducted. The results show that TOGG is a popular product with the public: there are many more positive Twitter comments related to TOGG than negative ones. The topics identified in social media are price expectancy, production facility, design and features. The most frequent topic for both positive and negative comments is price expectancy.";0;"Journal";"ar";"Article";100;2;2;"electric car | sentiment analysis | sustainable competitive advantage | text mining | topic model analysis";NA;21100892891;NA;"undefined";NA;0;FALSE;"20547552";"4";"386-399";NA;NA;2022
"98";98;98;"true";"https://api.elsevier.com/content/abstract/scopus_id/85123013062";"SCOPUS_ID:85123013062";"2-s2.0-85123013062";"Making sense of smart tourism destinations: A qualitative text analysis from Sweden";"Gelter J.";"Journal of Destination Marketing and Management";"2212571X";"23";"2022-03-01";"March 2022";"10.1016/j.jdmm.2022.100690";"S2212571X22000026";"The concept of smart tourism destinations has gained increased attention in research literature and among tourism stakeholders. However, the concept is still considered in need of more in-depth explanations for understanding and making sense of the notion. The contribution of the concept of smart tourism destinations to managerially relevant knowledge is particularly difficult to assess due to its complexity. Therefore, a qualitative text analysis of stakeholder interviews is proposed and conducted using the GABEK® methodology to identify recurring themes in the stakeholders' understanding of smart tourism destinations. The GABEK® methodology aims to represent the texts of open interviews as networks of interrelated keywords to make sense of a complex phenomenon. This study explores how destination stakeholders from two different Swedish destinations make sense of the concept of smart tourism destinations. Study findings show that, from the destination stakeholders' point of view, there is a need to counterbalance the currently dominant focus on technology with softer though more existential values to construct a sustainable path of destination development. As for the theoretical contribution, this study clarifies properties of smart tourism destinations and stakeholders’ sense-making of the concept of smart tourism destination.";4;"Journal";"ar";"Article";100;3;3;"GABEK® | Qualitative text analysis | Sense-making | Smart tourism destinations";"100690";21100228536;NA;"undefined";NA;1;TRUE;NA;NA;NA;"all";"All Open Access";2022
"99";99;99;"true";"https://api.elsevier.com/content/abstract/scopus_id/85122507035";"SCOPUS_ID:85122507035";"2-s2.0-85122507035";"An empirical comparison of machine learning methods for text-based sentiment analysis of online consumer reviews";"Alantari H.J.";"International Journal of Research in Marketing";"01678116";"39";"2022-03-01";"March 2022";"10.1016/j.ijresmar.2021.10.011";"S0167811621000926";"The amount of digital text-based consumer review data has increased dramatically and there exist many machine learning approaches for automated text-based sentiment analysis. Marketing researchers have employed various methods for analyzing text reviews but lack a comprehensive comparison of their performance to guide method selection in future applications. We focus on the fundamental relationship between a consumer's overall empirical evaluation, and the text-based explanation of their evaluation. We study the empirical tradeoff between predictive and diagnostic abilities, in applying various methods to estimate this fundamental relationship. We incorporate methods previously employed in the marketing literature, and methods that are so far less common in the marketing literature. For generalizability, we analyze 25,241 products in nine product categories, and 260,489 reviews across five review platforms. We find that neural network-based machine learning methods, in particular pre-trained versions, offer the most accurate predictions, while topic models such as Latent Dirichlet Allocation offer deeper diagnostics. However, neural network models are not suited for diagnostic purposes and topic models are ill equipped for making predictions. Consequently, future selection of methods to process text reviews is likely to be based on analysts’ goals of prediction versus diagnostics.";17;"Journal";"ar";"Article";100;4;4;"Automated text analysis | Machine learning | Natural language processing | Online reviews | Sentiment analysis | User generated content";NA;22833;NA;"undefined";NA;0;FALSE;NA;"1";"1-19";"all";"All Open Access";2022
"100";100;100;"true";"https://api.elsevier.com/content/abstract/scopus_id/85102511342";"SCOPUS_ID:85102511342";"2-s2.0-85102511342";"The informational value of multi-attribute online consumer reviews: A text mining approach";"Yi J.";"Journal of Retailing and Consumer Services";"09696989";"65";"2022-03-01";"March 2022";"10.1016/j.jretconser.2021.102519";"S0969698921000850";"In the digital age, customers use online reviews to minimize the risks associated with purchasing a product. Major online retailers help customers choose the right product by exposing reviews that received many “helpful” votes at the top of the review section. Given that reviews that have received the maximum helpfulness votes are considered more important in purchase decisions, understanding determinants of helpfulness votes offers clear benefits to online retailers and review platforms. This study focuses on the effect of review informativeness, which is measured by the number of attributes discussed in a review, and its interplay of review valence on customers' perception of review helpfulness. We applied a word-level bigram analysis to derive product attributes from review text and examined the influence of the number of attributes on the review's helpfulness votes. More importantly, we also suggested the moderating role of review valence. Estimation results of the Zero-inflated Poisson models on 21,125 reviews across 14 wireless earbuds indicated that as more attributes are discussed in a review, the more the review can earn helpfulness votes from customers. Furthermore, the positive association between the number of attributes and helpfulness was enhanced among negative reviews. This study contributes to customers' information processing literature and offers guidelines to online retailers in designing a better decision support system.";15;"Journal";"ar";"Article";100;2;2;"Big data analysis | Bigram analysis | Multi-attribute reviews | Review helpfulness | Review informativeness";"102519";22992;NA;"undefined";NA;0;FALSE;NA;NA;NA;NA;NA;2022
"101";101;101;"true";"https://api.elsevier.com/content/abstract/scopus_id/85117124447";"SCOPUS_ID:85117124447";"2-s2.0-85117124447";"Mining Consumer Minds: Downstream Consequences of Host Motivations for Home-Sharing Platforms";"Chung J.";"Journal of Consumer Research";"00935301";"48";"2022-02-01";"1 February 2022";"10.1093/jcr/ucab034";NA;"This research sheds light on consumer motivations for participating in the sharing economy and examines downstream consequences of the uncovered motivations. We use text-mining techniques to extract Airbnb hosts' motivations from their responses to the question ""why did you start hosting.""We find that hosts are driven not only by the monetary motivation ""to earn cash""but also by intrinsic motivations such as ""to share beauty""and ""to meet people.""Using extensive transaction-level data, we find that hosts with intrinsic motivations post more property photos and write longer property descriptions, demonstrating greater engagement with the platform. Consequently, these hosts receive higher guest satisfaction ratings. Compared to hosts who want to earn cash, hosts motivated to meet people are more likely to keep hosting and to stay active on the platform, and hosts motivated to share beauty charge higher prices. As a result, these intrinsically motivated hosts have a higher customer lifetime value compared to those with a monetary motivation. We employ a multimethod approach including text mining, Bayesian latent attrition models, and lab experiments to derive these insights. Our research provides an easy-to-implement approach to uncovering consumer motivations in practice and highlights the consequential role of these motivations for firms.";8;"Journal";"ar";"Article";100;5;5;"Airbnb | customer engagement | customer lifetime value | motivation | sharing economy | text mining";NA;22899;NA;"undefined";NA;0;FALSE;NA;"5";"817-838";NA;NA;2022
"102";102;102;"true";"https://api.elsevier.com/content/abstract/scopus_id/85107472686";"SCOPUS_ID:85107472686";"2-s2.0-85107472686";"The “Idea Advantage”: How Content Sharing Strategies Impact Engagement in Online Learning Platforms";"Narang U.";"Journal of Marketing Research";"00222437";"59";"2022-02-01";"February 2022";"10.1177/00222437211017828";NA;"In recent years, online learning platforms (e.g., Coursera, edX) have experienced massive growth and have reached nearly 200 million learners. Although their reach is quite large, the impact of these platforms is constrained by a low level of learner engagement. In traditional face-to-face classrooms, educators aim to engage learners by asking them to participate in class discussions and share information about their identity and ideas. However, the effectiveness of these strategies in online learning platforms is uncertain. The authors examine this issue by assessing the impact of two different types of content sharing on learner engagement. The authors conduct a textual analysis of over 12,000 text postings during an 18-month period (Study 1) and a field experiment among over 2,000 learners (Study 2) in a popular Coursera offering by a large U.S. university. The results indicate that asking learners to share ideas (vs. their identity) has a stronger effect on their video consumption and assessment completion. The authors explain this “idea advantage” by suggesting that learners who share ideas (vs. identity) exhibit a greater degree of elaboration. This idea advantage is strongest for learners from English-speaking countries and those new to online learning.";5;"Journal";"ar";"Article";100;3;3;"education | engagement | field experiment | online platforms | student retention and performance | text mining | topic modeling | user-generated content";NA;22961;NA;"undefined";NA;0;FALSE;"15477193";"1";"61-78";NA;NA;2022
"103";103;103;"true";"https://api.elsevier.com/content/abstract/scopus_id/85104078942";"SCOPUS_ID:85104078942";"2-s2.0-85104078942";"Sustainability topic trends in the textile and apparel industry: a text mining-based magazine article analysis";"Li J.";"Journal of Fashion Marketing and Management";"13612026";"26";"2022-01-03";"3 January 2022";"10.1108/JFMM-07-2020-0139";NA;"Purpose: The purpose of this study is to (1) identify the sustainable practices developed by the textile and apparel industry and (2) investigate the gaps and opportunities in the sustainability implementation process by quantitively analyzing the sustainability topics and the relevant topic trends. Design/methodology/approach: This study employed text mining techniques. A total of 1,168 relevant magazine articles published from 2013 to 2020 were collected and then categorized according to their tones. In total, 36 topics were identified by reviewing the sustainability issues in the industry. The frequency of each topic mentioned in the articles and the correlation coefficients between topics' frequencies and published time were calculated. The results were used to examine if the three sustainability dimensions (environment, society, economy) were equally addressed and identify opportunities in the sustainability implementation process. Findings: There were much fewer social and economic topics than environmental topics discussed in the articles. Additionally, there were not enough practices developed to reduce microfiber pollution, improve consumers' knowledge of sustainability, offset the carbon footprint, build a transparent, sustainable supply chain and avoid animal cruelty. Originality/value: There is a lack of research focusing on the whole supply chain and sustainability when investigating sustainable practices and topic trends. This study fills a part of the gap. The results can be used by industrialists to identify sustainable practice opportunities and better manage their sustainable supply chains. Researchers can utilize the results to compare the topics in the industry with the topics studied in academia.";6;"Journal";"ar";"Article";100;2;2;"Magazine articles | Supply chain | Sustainability | Text mining | Textile and apparel industry | Topic trends";NA;22920;NA;"undefined";NA;0;FALSE;NA;"1";"67-87";NA;NA;2022
"104";104;104;"true";"https://api.elsevier.com/content/abstract/scopus_id/85150089813";"SCOPUS_ID:85150089813";"2-s2.0-85150089813";"Natural Language Processing";"Hamilton L.M.";"Rapid Sensory Profiling Techniques: Applications in New Product Development and Consumer Research, Second Edition";NA;NA;"2022-01-01";"1 January 2022";"10.1016/B978-0-12-821936-2.00004-2";NA;"Sensory evaluation is predicated on the use and interpretation of human language. We ask our subjects to describe their sensory experiences and affective responses, which we cannot directly observe. This formulation of sensory science encourages direct engagement with linguistics and in particular, a recent subfield of linguistics, computer science, and artificial intelligence called “Natural Language Processing” (NLP, sometimes “computational linguistics”). In this chapter we will provide an introduction to Natural Language Processing (NLP) for sensory scientists who wish to employ NLP as a rapid method for sensory evaluation. Because NLP is a large, diverse, and rapidly evolving field, we will begin with a brief, pragmatic overview of the discipline, with an emphasis on key historical and current methods and applications. We will then briefly discuss the linguistic perspective and its application to sensory evaluation, with an aim to motivating the remaining chapter. Following that, we will discuss key areas of NLP, from data collection to processing to analysis to advanced applications. Throughout the chapter, we will use a consistent case study of natural-language descriptions for a food product to provide examples and illustrate NLP methods.";0;"Book";"ch";"Book Chapter";100;2;2;"Computational linguistics | Deep learning | Descriptive analysis | Machine learning | Natural Language Processing | Sensory evaluation | Text analysis";NA;21101140667;NA;"undefined";NA;0;FALSE;NA;NA;"371-410";NA;NA;2022
"105";105;105;"true";"https://api.elsevier.com/content/abstract/scopus_id/85147259597";"SCOPUS_ID:85147259597";"2-s2.0-85147259597";"Overnight Stock Movement Prediction with Contextualized Embedding Incorporating News and Stock";"Xu J.H.";"GCCE 2022 - 2022 IEEE 11th Global Conference on Consumer Electronics";NA;NA;"2022-01-01";"2022";"10.1109/GCCE56475.2022.10014070";NA;"This paper targets to predict overnight stock movement by taking contextualized news and stock information into account, using the Pre-trained Language Model (PLM) that was recently popular in Natural Language Processing (NLP) field. We proposed a model in which, given a piece of news and a stock code, the model can predict its overnight stock movement by utilizing combined news-stock embedding. Such embedding consists of (1) the contextualized embedding that contains the semantics of such a piece of news produced by a language model trained on a set of news and its paired stock movement. (2) The contextualized embedding is produced by a PLM trained on the information of stocks and the study as well as discussion on effect of introducing stock embedding are provided.";0;"Conference Proceeding";"cp";"Conference Paper";100;4;4;NA;NA;21101133203;NA;"undefined";NA;0;FALSE;NA;NA;"476-478";NA;NA;2022
"106";106;106;"true";"https://api.elsevier.com/content/abstract/scopus_id/85147249097";"SCOPUS_ID:85147249097";"2-s2.0-85147249097";"Code-switched Text Data Augmentation for Chinese-English Mixed Speech Recognition";"Lee C.T.";"GCCE 2022 - 2022 IEEE 11th Global Conference on Consumer Electronics";NA;NA;"2022-01-01";"2022";"10.1109/GCCE56475.2022.10014140";NA;"Code-switching is a common mode of language expression, which means that two or more languages are used interchangeably in a conversation. At present, the development of such code-switching technology in the field of speech recognition research is still limited by insufficient training corpus of text, which affects the system performance. This paper will use a neural network to train a generator to generate code-switching text to expand the corpus to achieve the purpose of improving the mixed recognition rate of Chinese and English. Our method is to use the Chinese and English texts in the SEAME corpus to train the BERT-BiLSTM-CRF model and use the model to know the code-switching position, generating sentences that conform to the characteristics of this corpus. The experimental results show that the method in this paper has better performance than other methods.";0;"Conference Proceeding";"cp";"Conference Paper";100;6;6;"BERT | Code-Switching | NLP | Speech Recognition";NA;21101133203;NA;"undefined";NA;0;FALSE;NA;NA;"922-923";NA;NA;2022
"107";107;107;"true";"https://api.elsevier.com/content/abstract/scopus_id/85146879074";"SCOPUS_ID:85146879074";"2-s2.0-85146879074";"Structural review of relics tourism by text mining and machine learning";"Das S.";"Journal of Tourism, Heritage and Services Marketing";NA;"8";"2022-01-01";"2022";"10.5281/zenodo.7358349";NA;"Purpose: The objective of the paper is to find trends of research in relic tourism-related topics. Specifically, this paper uncovers all published studies having latent issues with the keywords “relic tourism” from the Web of Science database. Methods: A total of 109 published articles (2002-2021) were collected related to “relic tourism.” Machine learning tools were applied. Network analysis was used to highlight top researchers in this field, their citations, keyword clusters, and collaborative networks. Text analysis and Bidirectional Encoder Representation from Transformer (BERT) of artificial intelligence model were used to predict text or keyword-based topic reference in machine learning. Results: All the papers are published basically on three primary keywords such as “relics,” “culture,” and “heritage.” Secondary keywords like “protection” and “development” also attract researchers to research this topic. The co-author network is highly significant for diverse authors, and geographically researchers from five countries are collaborating more on this topic. Implications: Academically, future research can be predicated with dense keywords. Journals can bring more special issues related to the topic as relic tourism still has some unexplored areas.";2;"Journal";"ar";"Article";100;4;4;"artificial intelligence | machine learning | relic tourism | Text analysis | topic modelling";NA;21101061456;NA;"undefined";NA;0;FALSE;"25291947";"2";"25-34";NA;NA;2022
"108";108;108;"true";"https://api.elsevier.com/content/abstract/scopus_id/85145840941";"SCOPUS_ID:85145840941";"2-s2.0-85145840941";"Sustainability in luxury: insights from Twitter activities";"Klaus P.";"Journal of Strategic Marketing";"0965254X";NA;"2022-01-01";"2022";"10.1080/0965254X.2022.2160874";NA;"Sustainability presents one of the most pressing challenges across different industries, especially for luxury brands. This study reveals the role of sustainability in luxury consumption by collecting and analyzing data from over half a million Tweets with 762 sustainability luxury consumption hashtags. Sustainability’s importance in online discussion is steadily increasing. Using balance theory, we combined sentiment and text mining to decrypt and reveal online audience’s perceptions of sustainable luxury. The findings highlight what online public considers sustainable, the importance of these perceptions for specific sectors of the luxury industry, and which emotions sustainable luxury perceptions trigger. We reveal online audience’s sentiments in the form of opinions, evaluations, and emotions toward sustainable luxury. This research serves as a critical exploration of the much-needed alignment between luxury and sustainability. This work aids not only scholars but also luxury brand managers in their aim to comprehend and keep pace with the increasing importance of sustainability in the luxury sector.";0;"Journal";"ar";"Article";100;3;3;"experience | luxury | perceptions | sentiment analysis | Sustainability | text analytics";NA;17900156718;NA;"undefined";NA;0;FALSE;"14664488";NA;NA;NA;NA;2022
"109";109;109;"true";"https://api.elsevier.com/content/abstract/scopus_id/85144503436";"SCOPUS_ID:85144503436";"2-s2.0-85144503436";"Co-branding strategies in luxury fashion: the Off-White case";"Murtas G.";"Journal of Strategic Marketing";"0965254X";NA;"2022-01-01";"2022";"10.1080/0965254X.2022.2160484";NA;"Increasing competition has induced brands to find ever more innovative ways to raise awareness. Among the latter, co-branding has recently become pervasive in the luxury fashion sector. Despite the growing interest in co-branding, no study to date has examined how luxury fashion brands can strategically combine different types of co-branding and the amount of media visibility that they can gain by means of these brand alliances. Drawing on both case study analysis and automated text analysis, this paper on the longitudinal case of the luxury fashion brand Off-White offers important managerial implication. It shows that, to create a successful co-branding portfolio, luxury brands should initially collaborate with renowned brands in the same target market, and only later with brands operating in other sectors. This study also reports empirical findings with which to understand what are the most suitable forms of co-branding to pursue to increase media visibility and consumers’ engagement in social media.";0;"Journal";"ar";"Article";100;4;4;"co-branding | collaborations | fashion | Luxury | luxury brands";NA;17900156718;NA;"undefined";NA;0;FALSE;"14664488";NA;NA;NA;NA;2022
"110";110;110;"true";"https://api.elsevier.com/content/abstract/scopus_id/85144463165";"SCOPUS_ID:85144463165";"2-s2.0-85144463165";"Tighter nets for smaller fishes? Mapping the development of statistical practices in consumer research between 2008 and 2020";"Krefeld-Schwalb A.";"Marketing Letters";"09230645";NA;"2022-01-01";"2022";"10.1007/s11002-022-09662-3";NA;"During the last decade, confidence in many social sciences, including consumer research, has been undermined by doubts about the replicability of empirical research findings. These doubts have led to increased calls to improve research practices and adopt new measures to increase the replicability of published work from various stakeholders such as funding agencies, journals, and scholars themselves. Despite these demands, it is unclear to which the research published in the leading consumer research journals has adhered to these calls for change. This article provides the first systematic empirical analysis of this question by surveying three crucial statistics of published consumer research over time: sample sizes, effect sizes, and the distribution of published p values. The authors compile a hand-coded sample of N = 258 articles published between 2008 and 2020 in the Journal of Consumer Psychology, the Journal of Consumer Research, and the Journal of Marketing Research. An automated text analysis across all publications in these three journals corroborates the representativeness of the hand-coded sample. Results reveal a substantial increase in sample sizes above and beyond the use of online samples along with a decrease in reported effect sizes. Effect and samples sizes are highly correlated which at least partially explains the reduction in reported effect sizes.";0;"Journal";"ar";"Article";100;2;2;"Experimental research methods | False-positive results | Review";NA;23687;"SNF";"172806";"Schweizerischer Nationalfonds zur Förderung der Wissenschaftlichen Forschung";0;FALSE;"1573059X";NA;NA;NA;NA;2022
