"";"X";"entry_number";"X._fa";"prism.url";"dc.identifier";"eid";"dc.title";"dc.creator";"prism.publicationName";"prism.issn";"prism.volume";"prism.coverDate";"prism.coverDisplayDate";"prism.doi";"pii";"dc.description";"citedby_count";"prism.aggregationType";"subtype";"subtypeDescription";"author_count..limit";"author_count..total";"author_count..";"authkeywords";"article_number";"source_id";"fund_acr";"fund_no";"fund_sponsor";"openaccess";"openaccessFlag";"prism.eIssn";"prism.issueIdentifier";"prism.pageRange";"freetoread.value..";"freetoreadLabel.value..";"year"
"323";323;323;"true";"https://api.elsevier.com/content/abstract/scopus_id/85047658500";"SCOPUS_ID:85047658500";"2-s2.0-85047658500";"Assessment of service quality using text mining – evidence from private sector banks in India";"Chakrabarti S.";"International Journal of Bank Marketing";"02652323";"36";"2018-06-21";"21 Jun 2018";"10.1108/IJBM-04-2017-0070";NA;"Purpose: As the retail banking institutions are becoming more customer centric, their focus on service quality is increasing. Established service quality frameworks such as SERVQUAL and SERVPERF have been applied in the banking sector. While these models are widely accepted, they are expensive because of the need for replication across bank branches. The purpose of this paper is to propose a novel, user friendly and cost effective approach by amalgamating the traditional concept of service quality in banks (marketing base) and sentiment analysis literature (information systems base). Design/methodology/approach: In this study, the main objective is to analyze user reviews to better understand the correlation between RATER dimension sentiment scores as independent variables and user overall rating (customer satisfaction) grouping in “good” and “bad” as dependent variable through development of authors’ own logistic regression model using lexicon-based sentiment analysis. The model has been developed for three largest private banks in India pertaining to three banking product categories of loans, savings and current accounts and credit cards. Findings: The results show that the responsiveness and tangibles dimensions significantly impact the user evaluation rating. Even though the three largest private banks in India are concentrating on the tangibles dimension, not all of them are sufficiently focused on the responsiveness dimension. Additionally, customers looking for loan products are more susceptible to negative perceptions on service quality. Originality/value: This study has highlighted two types of scores whereby user provided overall evaluation scores help provide validation to the sentiment scores. The developed model can be used to assess performance of a bank in comparison to its peers and to generate in depth insights on point of parity (POP) and point of difference (POD) fronts.";13;"Journal";"ar";"Article";100;3;3;"Customer satisfaction | Service marketing | Service quality";NA;145229;NA;"undefined";NA;0;FALSE;NA;"4";"594-615";NA;NA;2018
"324";324;324;"true";"https://api.elsevier.com/content/abstract/scopus_id/85047653646";"SCOPUS_ID:85047653646";"2-s2.0-85047653646";"Online sentiment analysis in marketing research: a review";"Rambocas M.";"Journal of Research in Interactive Marketing";"20407122";"12";"2018-05-25";"25 May 2018";"10.1108/JRIM-05-2017-0030";NA;"Purpose: The explosion of internet-generated content, coupled with methodologies such as sentiment analysis, present exciting opportunities for marketers to generate market intelligence on consumer attitudes and brand opinions. The purpose of this paper is to review the marketing literature on online sentiment analysis and examines the application of sentiment analysis from three main perspectives: the unit of analysis, sampling design and methods used in sentiment detection and statistical analysis. Design/methodology/approach: The paper reviews the prior literature on the application of online sentiment analysis published in marketing journals over the period 2008-2016. Findings: The findings highlight the uniqueness of online sentiment analysis in action-oriented marketing research and examine the technical, practical and ethical challenges faced by researchers. Practical implications: The paper discusses the application of sentiment analysis in marketing research and offers recommendations to address the challenges researchers confront in using this technique. Originality/value: This study provides academics and practitioners with a comprehensive review of the application of online sentiment analysis within the marketing discipline. The paper focuses attention on the limitations surrounding the utilization of this technique and provides suggestions for mitigating these challenges.";69;"Journal";"re";"Review";100;2;2;"High technology marketing | Methodology | Online marketing | Qualitative research | Quantitative research | Text mining";NA;19700201414;NA;"undefined";NA;0;FALSE;NA;"2";"146-163";NA;NA;2018
"325";325;325;"true";"https://api.elsevier.com/content/abstract/scopus_id/85045389535";"SCOPUS_ID:85045389535";"2-s2.0-85045389535";"Food Nutrition Visualization on Google Glass: Design Tradeoff and Field Evaluation";"Jiang H.";"IEEE Consumer Electronics Magazine";"21622248";"7";"2018-05-01";"May 2018";"10.1109/MCE.2018.2797740";NA;"Acquiring nutritional information before buying and eating food is crucial for making healthier choices and more educated selections. Therefore, there is a demand for electronic devices that can automatically access nutrition information. To help with this, we propose a novel augmented reality (AR)-based wearable food-monitoring system to make food nutritional information available and visible in real-life scenarios, such as at the supermarket. It combines reverse image search (RIS) and text mining to recognize the food, and then it retrieves nutritional information from a remote database. For userfriendliness, the information is overlaid on a live feed from a front-facing camera.";21;"Trade Journal";"ar";"Article";100;4;4;NA;NA;21100337101;NA;"undefined";NA;0;FALSE;"21622256";"3";"21-31";NA;NA;2018
"326";326;326;"true";"https://api.elsevier.com/content/abstract/scopus_id/85062666532";"SCOPUS_ID:85062666532";"2-s2.0-85062666532";"A synthesis of the consumer-brand relationship domain: Using text mining to track research streams, describe their emotional associations, and identify future research priorities";"Albert N.";"Journal of the Association for Consumer Research";"23781815";"3";"2018-04-01";"1 April 2018";"10.1086/696825";NA;"We conduct a text-mining analysis of 287 articles representing the consumer-brand relationship (CBR) literature from 1999 to 2015. We propose that the CBR domain is reflected by 71 constructs, of which less than half can be considered important. We structure the domain by identifying its seven major research streams as well as demarcating their respective evolution and emotional features. Using the original data and incorporating a second corpus based on the articles included in the current Journal of the Association for Consumer Research issue on “Brand Relationships, Emotions, and the Self”, we outline a collection of insights that define opportunities for future research.";21;"Journal";"ar";"Article";100;2;2;NA;NA;21101021052;NA;"undefined";NA;0;FALSE;"23781823";"2";"130-146";NA;NA;2018
"327";327;327;"true";"https://api.elsevier.com/content/abstract/scopus_id/85044845432";"SCOPUS_ID:85044845432";"2-s2.0-85044845432";"Automated text analysis for consumer research";"Humphreys A.";"Journal of Consumer Research";"00935301";"44";"2018-04-01";"1 April 2018";"10.1093/jcr/ucx104";NA;"The amount of digital text available for analysis by consumer researchers has risen dramatically. Consumer discussions on the internet, product reviews, and digital archives of news articles and press releases are just a few potential sources for insights about consumer attitudes, interaction, and culture. Drawing from linguistic theory and methods, this article presents an overview of automated text analysis, providing integration of linguistic theory with constructs commonly used in consumer research, guidance for choosing amongst methods, and advice for resolving sampling and statistical issues unique to text analysis. We argue that although automated text analysis cannot be used to study all phenomena, it is a useful tool for examining patterns in text that neither researchers nor consumers can detect unaided. Text analysis can be used to examine psychological and sociological constructs in consumerproduced digital text by enabling discovery or by providing ecological validity.";286;"Journal";"ar";"Article";100;2;2;"Automated content analysis | Automated text analysis | Computational linguistics | Computer-assisted text analysis";NA;22899;NA;"undefined";NA;0;FALSE;NA;"6";"1274-1306";NA;NA;2018
"328";328;328;"true";"https://api.elsevier.com/content/abstract/scopus_id/85048740946";"SCOPUS_ID:85048740946";"2-s2.0-85048740946";"Making online content viral through text analysis";"Dilip R.C.";"2018 IEEE International Conference on Consumer Electronics, ICCE 2018";NA;"2018-January";"2018-03-26";"26 March 2018";"10.1109/ICCE.2018.8326164";NA;"Each and every day there are lots and lots of contents being published on the web. May it be blogs, news articles, movie reviews, product reviews, etc. Although this many number of contents are published, how far a content reaches and engages a large number of expected audience is questionable and unpredictable. Our project aims to solve this issue. The goal of our project is to develop a system that, when a post or textual content is given as an input, makes it to go viral on the web. Our project is the first to propose such a solution for this problem. To make a post go viral, we follow two approaches. First one is to improve the content of the post to incorporate emotions and sentiments. The other one is to take a post directly to its potential audience. The initial step of the first approach is deriving some rules. The next step is where we analyze the actual post, measure its popularity and give suggestions as to how to improve the post in order to make it viral, based on the derived rules. The suggestions will be to replace certain words. The final part is the second approach towards solving the problem. Here, we analyze the social media posts of potential viewers of a post and understand what kind of decisions they may take in the future, so that we can recommend them directly with a certain post. Since we do the system for the domain of movies, we mine the text regarding a user's expectations to watch a certain kind of movie in the near future and recommend him with the reviews about the movie he may likely to watch.";3;"Conference Proceeding";"cp";"Conference Paper";100;5;5;NA;NA;21101081079;NA;"undefined";NA;0;FALSE;NA;NA;"1-6";NA;NA;2018
"329";329;329;"true";"https://api.elsevier.com/content/abstract/scopus_id/85059171693";"SCOPUS_ID:85059171693";"2-s2.0-85059171693";"Topic modelling for open-ended survey responses";"Chen S.";"Applied Marketing Analytics";"20547544";"4";"2018-03-01";"Spring 2018";NA;NA;"Due to the availability of massive amounts of text data, both from online (Twitter, Facebook, online forums, etc) and offline open-ended survey questions, text analytics is growing in marketing research and analytics. Most companies are now using open-ended survey questions to solicit customer opinions on any number of topics (eg ‘how can we improve our service?’). With large sample sizes, however, the task of collating this information manually is practically impossible. This paper describes an end-to-end process to extract insight from text survey data via topic modelling. A case study from a Fortune 500 firm is used to illustrate the process.";5;"Journal";"ar";"Article";100;4;4;"Latent dirichlet allocation | Natural language processing | Open-ended questions | Text analysis | Topic modelling";NA;21100892891;NA;"undefined";NA;0;FALSE;"20547552";"1";"53-62";NA;NA;2018
"330";330;330;"true";"https://api.elsevier.com/content/abstract/scopus_id/85059144481";"SCOPUS_ID:85059144481";"2-s2.0-85059144481";"Conversational marketing: Creating compelling customer connections";"Sotolongo N.";"Applied Marketing Analytics";"20547544";"4";"2018-03-01";"Spring 2018";NA;NA;"Conversational interfaces allow people to direct devices and programs through natural dialogue. Chatbots (which integrate with messaging apps like Facebook Messenger) and virtual assistants (including Apple’s Siri and Amazon’s Alexa) are examples of conversational interfaces that have emerged in recent years. As adoption of conversational interfaces increases, so will opportunities for marketers to utilise them to better meet consumer needs. This paper highlights the trends driving the rise of conversational interfaces, identifies the types of conversational ‘jobs to be done’ for customers in the context of the marketing funnel, and discusses the implications of conversational data for marketers.";20;"Journal";"ar";"Article";100;2;2;"Artificial intelligence | Chat | Chatbots | Conversational interfaces | Conversational marketing | Natural language processing | Smart speakers | Virtual assistants | Voice";NA;21100892891;NA;"undefined";NA;0;FALSE;"20547552";"1";"6-21";NA;NA;2018
"331";331;331;"true";"https://api.elsevier.com/content/abstract/scopus_id/85057168962";"SCOPUS_ID:85057168962";"2-s2.0-85057168962";"Designing a Marketing Analytics Course for the Digital Age";"Liu X.";"Marketing Education Review";"10528008";"28";"2018-01-02";"2 January 2018";"10.1080/10528008.2017.1421049";NA;"Marketing analytics is receiving great attention because of evolving technology and the radical changes in the marketing environment. This study aims to assist the design and implementation of a marketing analytics course. We assembled a rich data set from four sources: business executives, 400 employers’ job postings, one million tweets about marketing analytics from Twitter, and 13 course syllabi downloaded from the Internet. We apply text-mining techniques to generate insights from this big data set of electronic texts. By integrating insights from marketing practitioners and professors, we have designed a marketing analytics course and offer solutions for better structuring such courses. This study provides suggestions for marketing educators.";28;"Journal";"ar";"Article";100;2;2;NA;NA;21100887523;NA;"undefined";NA;0;FALSE;"21539987";"1";"28-40";NA;NA;2018
"332";332;332;"true";"https://api.elsevier.com/content/abstract/scopus_id/85125272036";"SCOPUS_ID:85125272036";"2-s2.0-85125272036";"Quantitative Insights from Qualitative Data: Using the Doubling Technique in Correspondence Analysis: An Abstract";"Treen E.";"Developments in Marketing Science: Proceedings of the Academy of Marketing Science";"23636165";NA;"2018-01-01";"2018";"10.1007/978-3-319-66023-3_149";NA;"We describe a study that began as a qualitative research piece, involving a series of depth interviews with a wide spectrum of art collectors. Text data from these interviews were analyzed using Watson, a natural language processing content analysis software that enables an identification of the main personality traits of each respondent. This software produced output percentile scores on the Big Five personality traits. The Big Five is the most widely used personality model and describes how a person engages with the world based on five dimensions: intro-/extraversion, agreeableness, conscientiousness, emotional stability, and openness. This data in turn became the input for a statistical analysis tool, correspondence analysis, which enabled us to group the respondents according to their personality traits and distinguish among different subgroups of art collectors to form more homogenous groups of art collectors based on the personality profiles. Due to the percentile scores of the output, we employed the use of a doubling technique to yield more valid results from the correspondence analysis. The doubling technique involved creating two points for each trait – the positive pole and the negative pole. This technique aided as a visual assessment for the grouping of art collectors into more homogenous groups based on personalities. The interpretation of the “doubled” points is effectively a visual assessment, for the total sample, of the distribution of the participant percentile scores for each of the five personality trait variables, which aided in grouping the respondents into distinct groups. Results showed four distinct groups of art collectors based on the relative personality profiles. The significance and implications of these results are discussed in regards to the four “types” of art collectors. Methodologically, this research addresses a means for marketing managers to uncover more insight into the psychographic traits of consumers.";0;"Book Series";"ch";"Book Chapter";100;2;2;"Correspondence Analysis | Doubling Technique | Main Personality Traits | Psychographic Traits | Quantitative Insights";NA;21101077266;NA;"undefined";NA;0;FALSE;"23636173";NA;"451-452";NA;NA;2018
"333";333;333;"true";"https://api.elsevier.com/content/abstract/scopus_id/85125270394";"SCOPUS_ID:85125270394";"2-s2.0-85125270394";"“I Can’t Wait to See This”: An Exploratory Research on Consumer Online Word-of-Mouth on Movies: An Abstract";"Kampani J.";"Developments in Marketing Science: Proceedings of the Academy of Marketing Science";"23636165";NA;"2018-01-01";"2018";"10.1007/978-3-319-66023-3_185";NA;"The success of a movie is often determined by its opening weekend performance (Earnest, 1985; Epstein, 2005; Gong et al., 2011). Using the most effective movie advertising tool, studios release trailers early in advance aiming to build heavy pre-release buzz which will in turn drive audiences to the cinema on the opening weekend. While pre-release movie buzz has proved to be instrumental in influencing box office performance, most electronic word-of-mouth (eWOM) research on movies is limited to the quantitative measurement of WOM metrics (e.g. volume, valence) (Hennig-Thurau et al., 2015; Liu, 2006), overlooking other significant information that could offer insight on early audience perceptions. Very recent research on the antecedents of movie WOM has identified that the combination of liking the trailer along with understanding what the movie is about increases the likelihood of viewers engaging in favourable pre-release WOM and in paying to see the movie at the cinema (Archer-Brown et al,. 2017). Focusing on the concept of understanding, this work-in-progress aims to investigate the mechanisms through which consumers draw inferences and eventually form perceptions on upcoming movies when viewing trailers. Approximately seven million data points on wide-release movies have been collected from Twitter and YouTube since November 2015. Content analysis will be performed on the data through automated natural language processing techniques, where networks of words will be drawn as an innovative way to visualise user-generated content. Early results on the analysis of three movies suggest that viewers utilise different techniques in inference-making depending on prior knowledge about the movie. eWOM on sequel movies focuses on the appearance and on the prominence of characters, while WOM on true story adaptations is richer with debates on how events truly happened and with the provision of secondary sources of information. Finally, WOM on movies with original storylines suggests that viewers rely on heuristic cues – such as the stars’ and directors’ previous work or other same-genre movies – when trying to fill in missing information about the movie’s plot. This is the first part of an ongoing research project which eventually aims to construct a framework for classifying comprehensive trailers and identifying their relationship to favourable WOM and to box office performance. Theoretical contributions will be made towards advertising and WOM theory, by delving deeper into a newly added WOM antecedent. Managerial contributions include the design of effectively comprehensive promotional material as well as methodologies which can be adopted to gain insight on early audience perceptions.";1;"Book Series";"ch";"Book Chapter";100;3;3;NA;NA;21101077266;NA;"undefined";NA;0;FALSE;"23636173";NA;"563-564";NA;NA;2018
"334";334;334;"true";"https://api.elsevier.com/content/abstract/scopus_id/85125168099";"SCOPUS_ID:85125168099";"2-s2.0-85125168099";"An Abstract: Healthy Food Promotion with an App?";"Gurviez P.";"Developments in Marketing Science: Proceedings of the Academy of Marketing Science";"23636165";NA;"2018-01-01";"2018";"10.1007/978-3-319-99181-8_145";NA;"Connected devices can be used in a social marketing perspective to mix virtual entertainment and real commitment to a behavioral change, such as a healthier diet for a better life. Whereas the literature on healthy diet programs based on the use of connected device(s) include numerous surveys, our review showed a low use of theoretical frameworks in previous studies. Furthermore nearly all studies reported a decrease in program usage throughout the intervention period. As a conclusion, behavioral changes have been observed in a certain amount of studies but small and on short periods, conclusions remaining rather unclear. Moreover most studies concentrated on extrinsic factors and hardly took into account intrinsic factors such as participants’ motivations and barriers to engaging themselves in a long-term healthy diet program. Following a transformative agenda (Mick et al. 2012), we intend to consider our target as experts on their needs and wants toward a healthier diet and the potential help of connected devices. We conducted a qualitative research in Parisian region (France) with four focus groups (27 participants). We targeted both men and women having tried to lose weight in the last 5 years; the sample diversity ensures the representation of other important criteria, such as educational level and the familiarity with connected devices. During the focus groups, we used a probing approach (Mattelmäki 2008) for co-exploring which device and which design could better help the participants to lose weight in a long term, considering them as collaborative stakeholders. Data analysis used softwares (NVivo 11 and Alceste) for a text analysis and a content analysis. Results highlight motivation as the major factor compared to the type of devices used (website, app, or connected devices such as Fitbit or HAPIfork) and the type of messages. They suggest that self-determination (Ryan and Deci 2000) is a major factor to participants’ motivations and compliance to digital tailored prompt messages. Clearly, a friendly app is their favorite tool. They consider it as their best ally to follow a diet program. Our results indicate this importance of maintaining motivation in a long term by satisfying the needs of autonomy, competence, and relatedness. All the participants point out the need for being nudged, not judged. Nevertheless, less educated and less familiar to IT participants are the most reluctant to digital devices.";0;"Book Series";"ch";"Book Chapter";100;3;3;NA;NA;21101077266;NA;"undefined";NA;0;FALSE;"23636173";NA;"441-442";NA;NA;2018
