"";"X";"entry_number";"X._fa";"prism.url";"dc.identifier";"eid";"dc.title";"dc.creator";"prism.publicationName";"prism.issn";"prism.volume";"prism.coverDate";"prism.coverDisplayDate";"prism.doi";"pii";"dc.description";"citedby_count";"prism.aggregationType";"subtype";"subtypeDescription";"author_count..limit";"author_count..total";"author_count..";"authkeywords";"article_number";"source_id";"fund_acr";"fund_no";"fund_sponsor";"openaccess";"openaccessFlag";"prism.eIssn";"prism.issueIdentifier";"prism.pageRange";"freetoread.value..";"freetoreadLabel.value..";"year"
"211";211;211;"true";"https://api.elsevier.com/content/abstract/scopus_id/85091434156";"SCOPUS_ID:85091434156";"2-s2.0-85091434156";"An empirical study on anthropomorphism and engagement with disembodied AIs and consumers' re-use behavior";"Moriuchi E.";"Psychology and Marketing";"07426046";"38";"2021-01-01";"January 2021";"10.1002/mar.21407";NA;"The integration of artificial intelligence (AI) into the human race has gradually become a norm. AI entails technology assemblages such as machine learning, natural language processing, and reasoning. The influence of AI systems has intensified in consumers' daily lives. Many consumers have interacted with the notions of AI through advertisements or having personal experiences. Many consumers are curious about the use of AI. This paper reports three studies conducted to determine whether anthropomorphism (ANTH) and engagement play a role in consumers' intention to re-use a voice assistant (VA; a machine-learning AI). The second study will determine if ANTH and engagement play a role when consumers are using the VAs for different activities (task completion vs. information gathering). In addition, in Study 2, actual re-use behavior was also tested in the model, which encouraged a stronger overall model fit. The results show that in general effort expectation (EE) has a strong positive impact on consumers' usage experience of the VA. However, between the two types of activities, EE has a stronger impact on consumers' usage experience for information-gathering activities, whereas performance expectation has a stronger impact on usage experience when consumers use the VA for task-completion purposes. The third study used internet usage experience as a moderating variable to determine the boundaries of the mediating effects in the study. The results show that the mediators yield results similar to prior studies.";55;"Journal";"ar";"Article";100;1;1;"anthropomorphism | artificial intelligence | engagement | intention to re-use | realism maximization theory";NA;14014;NA;"undefined";NA;0;FALSE;"15206793";"1";"21-42";NA;NA;2021
"212";212;212;"true";"https://api.elsevier.com/content/abstract/scopus_id/85083557523";"SCOPUS_ID:85083557523";"2-s2.0-85083557523";"Exploring values affecting e-Learning adoption from the user-generated-content: A consumption-value-theory perspective";"Ray A.";"Journal of Strategic Marketing";"0965254X";"29";"2021-01-01";"2021";"10.1080/0965254X.2020.1749875";NA;"The aim of this study is to utilise the user-generated content from social media platforms and merchandise websites to explore various values affecting behavioural intention in context of e-Learning services from the consumption-value-theory perspective. This study has utilised a novel mixed-method approach based on natural language processing (NLP) techniques for the both the qualitative and quantitative analysis. This study has used user-generated content of Coursera (an e-Learning service) consisting of online reviews from Coursera-100 k-dataset and tweets about Coursera. Some of the important themes generated from the thematic-based analysis of tweets are ‘value addition’, ‘course content’, ‘topic cover’, ‘reliability of course’, ‘course quality’, ‘enjoyed course’, ‘recommend the course’, ‘value for money’, ‘facilitator skills’, etc. Results of the empirical study reveal that offers and deals, emotional connect, facilitator quality, course reliability, platform innovativeness, and compatibility are important predictors of behavioural intention. This study concludes with the various limitations and future directions.";24;"Journal";"ar";"Article";100;3;3;"consumption value theory (CVT) | e-Learning services | latent dirichlet allocation (LDA) | natural language processing (NLP)-based approach | topic-modeling | user generated data";NA;17900156718;NA;"undefined";NA;0;FALSE;"14664488";"5";"430-452";"all";"All Open Access";2021
"213";213;213;"true";"https://api.elsevier.com/content/abstract/scopus_id/85077154834";"SCOPUS_ID:85077154834";"2-s2.0-85077154834";"Lines of Scientific Research in the Study of Blood Donor Behavior from a Social Marketing Perspective";"Romero-Domínguez L.";"Journal of Nonprofit and Public Sector Marketing";"10495142";"33";"2021-01-01";"2021";"10.1080/10495142.2019.1707741";NA;"Although blood is essential in healthcare systems for medical and surgical use, it is still a scarce resource. Given that blood cannot be produced artificially, donors are the backbone of the system, which is why it is crucial for transfusion centers to understand the factors that determine their behavior. The goal of this study is to help decision-makers at transfusion understand what lines of research have been developed in the literature and which ones might be useful to define and assess actions related to the attributes of the donation system and donor behavior. To that end, this work aims to present an overview of the available literature on blood donor behavior from a social marketing perspective, which is of paramount importance in the context of blood donation. Based on the results of this review, which was performed by using the text mining methodology, this study presents current lines of investigation, and proposes additional future lines.";2;"Journal";"ar";"Article";100;4;4;"blood donation | blood donor behavior | content analysis | Social marketing | text mining";NA;4700152754;"MINECO";"ECO2015-64875-R";"Ministerio de Economía y Competitividad";0;FALSE;"15406997";"3";"307-358";NA;NA;2021
"214";214;214;"true";"https://api.elsevier.com/content/abstract/scopus_id/85076455134";"SCOPUS_ID:85076455134";"2-s2.0-85076455134";"Gender and the CMO: do the differences make a difference?";"Pitt C.";"Journal of Strategic Marketing";"0965254X";"29";"2021-01-01";"2021";"10.1080/0965254X.2019.1694567";NA;"Despite efforts to address the lack of female representation in executive leadership roles, the number of women in leadership roles is still low in comparison to men. Data in the form of online interviews were collected for a sample of 69 CMOs from the World’s Most Influential CMO’s report by Forbes Magazine and analyzed using the automated text analysis software, LIWC, employing the dimensions of Analytic, Clout, Authentic, and Tone. A series of ANOVAs was conducted to determine the impact of gender on these dimensions. Clout and Authentic were significantly impacted by the gender of the CMO. The paper considers two gender communication theories that could potentially explain these differences. The paper concludes by discussing managerial implications, acknowledging the limitations, and identifying avenues for future research.";5;"Journal";"ar";"Article";100;1;1;"Chief Marketing Officer | CMO | Gender | LIWC";NA;17900156718;NA;"undefined";NA;1;TRUE;"14664488";"4";"301-315";"all";"All Open Access";2021
"215";215;215;"true";"https://api.elsevier.com/content/abstract/scopus_id/85097615908";"SCOPUS_ID:85097615908";"2-s2.0-85097615908";"A consumer engagement systematic review: synthesis and research agenda";"Bilro R.G.";"Spanish Journal of Marketing - ESIC";"24449695";"24";"2020-12-16";"16 Dec 2020";"10.1108/SJME-01-2020-0021";NA;"Purpose: This paper aims to review the existing literature about consumer engagement, provide an accurate mapping of this research field, propose a consumer engagement typology and a conceptual framework and offer a research agenda for this domain. Design/methodology/approach: A systematic literature review using several quality filters was performed, producing a top-quality pool of 41 papers. After that, a text mining analysis was conducted, and five major research streams emerged. Findings: This paper proposes five distinct research streams based on the text mining analysis, namely, consumer engagement, online brand community engagement, consumer-brand engagement, consumer engagement behaviours and media engagement. Based on this, a consumer engagement typology and a conceptual framework are suggested and a research agenda is proposed. Originality/value: This paper presents scientific value and originality because of the new character of the topic and the research methods used. This research is the first study to perform a systematic review and using a text-mining approach to examine the literature on consumer engagement. Based on this, the authors define consumer engagement typology. A research agenda underlining emerging future research topics for this domain is also proposed.";37;"Journal";"re";"Review";100;2;2;"Consumer engagement | Consumer engagement typology | Consumer-brand engagement | Online brand community engagement | Systematic literature review | Text mining";NA;21100855756;"FCT";"UIDB/00315/2020";"Fundação para a Ciência e a Tecnologia";1;TRUE;"24449709";"3";"283-307";"all";"All Open Access";2020
"216";216;216;"true";"https://api.elsevier.com/content/abstract/scopus_id/85117444823";"SCOPUS_ID:85117444823";"2-s2.0-85117444823";"An efficient framework for classifying the Clothing items based on fashion and fabric of the images";"Nandyal S.";"Proceedings of 2020 IEEE International Conference on Technology, Engineering, Management for Societal Impact Using Marketing, Entrepreneurship and Talent, TEMSMET 2020";NA;NA;"2020-12-10";"10 December 2020";"10.1109/TEMSMET51618.2020.9557432";NA;"In recent days classification of images over fashion domain has become fundamental research problem with lot of computer vision based applications. In most of the existing research image classification is done based on the labels on the objects, however in the real world scenarios the images needs to classified into the labels based on the domain specific with proper guidelines, therefore the existing research works fails in achieving the evaluation measures like classification accuracy, precision, recall and time take taken for classification, Hence there is need of an efficient frameworks that classifies the images based on fashion and fabric by addressing existing research problems. This paper presents an efficient framework for segmenting using grab cut techniques with the integrating the histograms of oriented gradients (HOG) and the speeded-up robust features (SURF) techniques. Whereas HOG technique is used to retrieve the global features and SURF technique is used for the local features and then segmentation is done based on Scale-Invariant Feature Transform(SIFT) method that segments the line, solve the incident scaling, changes in lighting condition and rotation between the two images, Later classification of the clothing images is done by using feature matching classification techniques, with proper text analysis the classification of images is done based on color and fabric of the image. The proposed technique is compared with existing multi-level classification technique to prove the proposed framework is more efficient than existing works. With the proposed technique, we could able to achieve the accuracy of 93% by varying the dataset of the images which is 10-15% more accurate than existing multi-level classification.";0;"Conference Proceeding";"cp";"Conference Paper";100;2;2;"Fashion domain | Feature matching Classification | histograms of oriented gradients (HOG) | Scale-Invariant Feature Transform(SIFT) | Speeded-up robust features (SURF)";NA;21101062327;NA;"undefined";NA;0;FALSE;NA;NA;NA;NA;NA;2020
"217";217;217;"true";"https://api.elsevier.com/content/abstract/scopus_id/85153031128";"SCOPUS_ID:85153031128";"2-s2.0-85153031128";"Social media listening. From text analysis to the interpretation of the meanings";"Risi E.";"Micro and Macro Marketing";"11214228";"29";"2020-12-01";"December 2020";"10.1431/96468";NA;"The research methods based on the analysis of users-generated contents are an increasingly widespread practice in some companies. These contents analysis is able to observe the «living voice» of customers/users because they represent more spontaneous opinions and preferences than those found through traditional data collection settings. This paper discusses a qualitative-quantitative methodological approach for the study of users-generated contents. The proposed method combines the outputs that emerge from automated social media monitoring platforms, based on the semantic analysis, with an ethnographic approach deriving from the analysis of online contexts in which users' opinions are shared. The methodological model adopts an integrated and multi-methods approach and it is divided into three phases (con-textual analysis, textual analysis, extra-textual analysis). The method was applied to a case study of an Italian wine brand: the study aims to analyze the meanings associated with the brand, evaluating the alignment between the brand values and the brand image that it disseminates as perceived by users in their online conversations.";0;"Journal";"ar";"Article";100;2;2;"brand analysis | brand value | Online marketing research | social media monitoring | text analysis";NA;21101062818;NA;"undefined";NA;0;FALSE;"26122073";"3";"559-584";NA;NA;2020
"218";218;218;"true";"https://api.elsevier.com/content/abstract/scopus_id/85090359625";"SCOPUS_ID:85090359625";"2-s2.0-85090359625";"How safety affects destination image projected through online travel reviews";"Marine-Roig E.";"Journal of Destination Marketing and Management";"2212571X";"18";"2020-12-01";"December 2020";"10.1016/j.jdmm.2020.100469";"S2212571X20300913";"Destination image is a key factor for attracting tourists and wealth to destinations. With the spread of Web 2.0 and traveller-generated content, destination management organisations do not control the information regarding destination image formation through its cognitive, affective and conative components. The aim of the study is to analyse, using natural language processing techniques, whether the terrorist attack of August 2017 and the Catalan sovereignty process, which took place during the last quarter of 2017 in Barcelona, harmed the online destination image perceived and transmitted by tourists, through language recognition, frequency analysis and term categorisation of more than 150,000 online travel reviews, written in English, Spanish, French, German or Italian, posted on a shared-lodging platform. The findings show that visitors did not fear for their personal safety despite the seriousness and immense international media coverage of both events. The opinion of tourists, shared through online reviews, can help companies to improve the supply of goods and services.";35;"Journal";"ar";"Article";100;2;2;"Airbnb | Barcelona | Big data analytics | Destination image online | Image-formation agent | Political instability | Sentiment analysis | Terrorism";"100469";21100228536;"MINECO";"ECO2017-88984-R";"Ministerio de Economía, Industria y Competitividad, Gobierno de España";0;FALSE;NA;NA;NA;NA;NA;2020
"219";219;219;"true";"https://api.elsevier.com/content/abstract/scopus_id/85101930421";"SCOPUS_ID:85101930421";"2-s2.0-85101930421";"Towards Higher Customer Conversion Rate: An Interactive Chatbot Using the BEET Model";"Badawy W.";"IEEE International Conference on Consumer Electronics - Berlin, ICCE-Berlin";"21666814";"2020-November";"2020-11-09";"9 November 2020";"10.1109/ICCE-Berlin50680.2020.9352152";NA;"This paper presents an interactive Chatbot that increases the rate of customer conversion by observing the behavior emotion status. The trigger customer action accordingly using a customer behavior analysis model named ""Behavioral Emotion Engagement Trigger""BEET model. BEET extends the operation of the Chatbot beyond conversational AI, sentiment analysis to evaluate the emotional status of the customer then it aligns the response using BEET to engage customer along with their own priorities. The performance of the chatbot is measured according to its ability to understand and classify both people and sentiments then it measures their conversion rate.";1;"Conference Proceeding";"cp";"Conference Paper";100;3;3;"Artificial Intelligence | BEET | Behavioral Emotion Engagement Trigger | Chatbot | Customer Conversion | Natural Language Processing | Sentiment Analysis";"9352152";21100223125;NA;"undefined";NA;0;FALSE;"21666822";NA;NA;NA;NA;2020
"220";220;220;"true";"https://api.elsevier.com/content/abstract/scopus_id/85098887052";"SCOPUS_ID:85098887052";"2-s2.0-85098887052";"An Affective Service based on Multi-Modal Emotion Recognition, using EEG enabled Emotion Tracking and Speech Emotion Recognition";"Moschona D.S.";"2020 IEEE International Conference on Consumer Electronics - Asia, ICCE-Asia 2020";NA;NA;"2020-11-01";"1 November 2020";"10.1109/ICCE-Asia49877.2020.9277291";NA;"From 1964 to 1966 Joseph Weizenbaum created ELIZA - a natural language processing computer program. ELIZA engaged and simulated conversations with users, that gave them the illusion of being understood by the program, without in fact having any built in framework to do so. One of ELIZA's most famous script ""DOCTOR""simulated the method of 'Person-centered therapy' by responding with non-directional questions to user inputs. Weizenbaum was surprised by the number of individuals who attributed human-like feelings to the computer program. While ELIZA was capable of engaging in discourse, it could not converse with true understanding [1].";11;"Conference Proceeding";"cp";"Conference Paper";100;1;1;"Affective Computing | Affective Service | Brain waves | Brain-Computer Interface (BCI) | EEG enabled Emotion Tracking | Electroencephalography (EEG) | Emotion detection | Emotion recognition | Human-Computer Interaction (HCI) | Multi-Modal Emotion Recognition | Speech Emotion Recognition (SER) | Speech Recognition";"9277291";21101033252;NA;"undefined";NA;0;FALSE;NA;NA;NA;NA;NA;2020
"221";221;221;"true";"https://api.elsevier.com/content/abstract/scopus_id/85127997000";"SCOPUS_ID:85127997000";"2-s2.0-85127997000";"Negative customer experience in lifestyle hotels: A netnography perspective";"Santos M.V.";"Building Consumer-Brand Relationship in Luxury Brand Management";NA;NA;"2020-10-23";"23 October 2020";"10.4018/978-1-7998-4369-6.ch007";NA;"The primary purpose of the present research is to develop a methodology which can accurately analyse online public reviews on Google using Netnography studies combined with text mining analyses. By analysing the current techniques applied to a lifestyle hotel brand in nine properties in different countries and carefully studying how negative reviews are expressed online by costumers, this study aims to create a pattern of lifestyle customer complaints. This research seeks to demonstrate patterns of consumer behaviour that are not fully satisfied with the hotel service and how it can negatively affect the brand. This study identifies the areas that five stars lifestyle hoteliers and hotel managers need to pay attention to improve services, considering online reviews on online platforms, such as social networks and other tourism sites. Today, online reviews and customer experiences have a significant impact on the choice of a hotel.";0;"Book";"ch";"Book Chapter";100;2;2;NA;NA;21101084203;NA;"undefined";NA;0;FALSE;NA;NA;"126-157";NA;NA;2020
"222";222;222;"true";"https://api.elsevier.com/content/abstract/scopus_id/85099343492";"SCOPUS_ID:85099343492";"2-s2.0-85099343492";"A Comparative Approach to Naïve Bayes Classifier and Support Vector Machine for Email Spam Classification";"Ma T.M.";"2020 IEEE 9th Global Conference on Consumer Electronics, GCCE 2020";NA;NA;"2020-10-13";"13 October 2020";"10.1109/GCCE50665.2020.9291921";NA;"Spam or unsolicited emails that are used by spammers can cause huge loss to both the email users and the email server. Therefore, in order to detect spam emails not to enter into our mailbox, a developed email spam classification system is required. This paper proposes two popular machine learning methods, Naïve Bayes Classifier and Support Vector Machine, to classify the emails into spam or ham based on the body or content of the emails. In Naïve Bayes Classifier, independent words are considered as features. Support Vector Machine can be used to represent an email in vector space in which each feature means one dimension. Finally, two methods are compared in terms of precision, recall, F-measure performance metrics with the aim of finding the best method.";12;"Conference Proceeding";"cp";"Conference Paper";100;3;3;"Natural Language Processing | Naïve Bayes Classifier | Supervised Learning | Support Vector Machine";"9291921";21101033891;"KAKEN";"19K12139";"Japan Society for the Promotion of Science";0;FALSE;NA;NA;"324-326";NA;NA;2020
"223";223;223;"true";"https://api.elsevier.com/content/abstract/scopus_id/85075881467";"SCOPUS_ID:85075881467";"2-s2.0-85075881467";"Social media marketing of IT service companies: Analysis using a concept-linking mining approach";"Shen C.w.";"Industrial Marketing Management";"00198501";"90";"2020-10-01";"October 2020";"10.1016/j.indmarman.2019.11.014";"S0019850118307466";"The IT service industry values the experience of social familiarity, which is based on routine interactions with suppliers and customers and is at the frontier of social media marketing. To further understand how IT service companies use social media to engage their customers or potential leads, the objectives of this research are to delineate the differences between IT service companies’ use of social media and users’ expectations based on knowledge extracted from user-generated content on Twitter. We applied a text mining approach called two-tier concept-linking analysis to extract patterns in Twitter posts from top IT service companies as well as the related tweets from the Twitter users. We further compare the yearly similarities and differences of the key concepts from the company's official account and from the users. Besides, the key concepts between users’ expectations and IT service companies’ social media use were compared on the basis of first-tier concepts and further elaborated by their corresponding second-tier concepts. Our approach contributes to further understand the socio-cognitive insights underlying the dynamic social media data, from which organizations and individuals in charge can note the objectives they wish to maintain and the marketing gaps they wish to improve on.";31;"Journal";"ar";"Article";100;4;4;"Concept links | IT service industry | Social media mining | Twitter";NA;22792;"MOST";"108-2410-H-008-067";"Ministry of Science and Technology, Taiwan";0;FALSE;NA;NA;"593-604";NA;NA;2020
"224";224;224;"true";"https://api.elsevier.com/content/abstract/scopus_id/85098462864";"SCOPUS_ID:85098462864";"2-s2.0-85098462864";"Cyber-Physical System for Smart Factories: Case Study of the Taiwan Instrument Research Institute of the National Applied Research Laboratories";"Chou S.J.";"2020 IEEE International Conference on Consumer Electronics - Taiwan, ICCE-Taiwan 2020";NA;NA;"2020-09-28";"28 September 2020";"10.1109/ICCE-Taiwan49838.2020.9258139";NA;"A small-scale smart factory cyber-physical system (CPS) developed by the Taiwan Instrument Research Institute of the National Applied Research Laboratories uses visualization to decentralize big data searches and log mining. The ELK-acronym for three open source projects, Elasticsearch, Logstash, and Kibana-service effectively handles decentralized storage and processing, full-text searches, log mining, and visualization of big data. The real-time production system may thus be controlled to achieve smart management and factory optimization. This study introduced the construction of CPS, which connects with data obtained from optical factory sensors. Proposed to meet data collection needs, ELK was incorporated with an app to allow operation on mobile phones.";0;"Conference Proceeding";"cp";"Conference Paper";100;9;9;NA;"9258139";21101033078;"MOST";"107-2622-E-492-021 -CC3";"Ministry of Science and Technology, Taiwan";0;FALSE;NA;NA;NA;NA;NA;2020
"225";225;225;"true";"https://api.elsevier.com/content/abstract/scopus_id/85098461241";"SCOPUS_ID:85098461241";"2-s2.0-85098461241";"BERT-Based Stock Market Sentiment Analysis";"Lee C.C.";"2020 IEEE International Conference on Consumer Electronics - Taiwan, ICCE-Taiwan 2020";NA;NA;"2020-09-28";"28 September 2020";"10.1109/ICCE-Taiwan49838.2020.9258102";NA;"This paper explores the performance of natural language processing in financial sentiment classification. We collected people's views on U.S. stocks from the Stocktwits website. The messages on this website reflect investors' views on the stock. These messages are classified into positive or negative sentiments using a BERT-based language model. Investor sentiment can be further analyzed to help more investors, businesses or organizations make effective decisions. The experimental results show that the pre-trained BERT model has been fine-tuned on the labeled sentiment dataset, and can recognize the sentiment of investors with an accuracy of more than 87.3%.";2;"Conference Proceeding";"cp";"Conference Paper";100;3;3;"BERT | sentiment analysis | stock market";"9258102";21101033078;NA;"undefined";NA;0;FALSE;NA;NA;NA;NA;NA;2020
